<?xml version="1.0" encoding="UTF-8"?>
<!DOCTYPE iti SYSTEM "testiti.dtd">
<iti>
    <student track="power bi">
		<id>100</id>
		<name>ahmed</name>
		<email>nasr@nasr.com</email>
	</student>
	<student>
		<id>200</id>
		<name>ali</name>
	</student>
	<student>
		<id>300</id>
		<name>omar</name>
	</student>
</iti>





